{
  "name": "Tripp Lite UPS",
  "description": "Generic power profile for Tripp Lite UPS devices. Estimates real-time power consumption from load percentage, nominal VA rating, and power factor.",
  "device_type": "ups",
  "calculation_strategy": "fixed",
  "compatible_integrations": [
    "nut"
  ],
  "created_at": "2026-03-20T00:00:00Z",
  "measure_method": "manual",
  "measure_device": "N/A",
  "config_flow_discovery_remarks": "This profile estimates UPS output power from load percentage. You may need to enable the Nominal Power entity in the NUT integration to find your VA rating.",
  "fields": {
    "load_entity": {
      "label": "Load percentage entity",
      "description": "The NUT sensor showing UPS load percentage (0-100%)",
      "selector": {
        "entity": {
          "domain": "sensor"
        }
      }
    },
    "nominal_va": {
      "label": "Nominal Power (VA)",
      "description": "The VA rating of your UPS (found on the label or the Nominal Power entity)",
      "selector": {
        "number": {
          "min": 100,
          "max": 10000
        }
      }
    },
    "power_factor": {
      "label": "Power Factor",
      "description": "Ratio of real power to apparent power. Use 0.6 for computers/electronics, 1.0 for resistive loads like heaters. Default: 0.6",
      "selector": {
        "number": {
          "min": 0.1,
          "max": 1.0,
          "step": 0.1
        }
      }
    }
  },
  "fixed_config": {
    "power": "{{ states('[[load_entity]]') | float(0) / 100 * [[nominal_va]] | float(0) * [[power_factor]] | float(0.6) }}"
  },
  "author_info": {
    "name": "Brian Egge",
    "github": "brianegge",
    "email": "brianegge@gmail.com"
  },
  "author": "Brian Egge"
}
