{
  "aliases": [
    "9290012574"
  ],
  "calculation_strategy": "lut",
  "created_at": "2023-02-09T19:19:56Z",
  "device_type": "light",
  "measure_description": "Measured with utils/measure script",
  "measure_device": "Shelly Plug S",
  "measure_method": "script",
  "measure_settings": {
    "SAMPLE_COUNT": 2,
    "SLEEP_TIME": 3,
    "VERSION": "v1.3.1:docker"
  },
  "name": "Hue White and Color Ambiance B22/E27 806lm",
  "standby_power": 0.33
}
