{
  "aliases": [
    "Hardware Bridge"
  ],
  "calculation_strategy": "fixed",
  "created_at": "2025-04-20T16:30:06Z",
  "device_type": "generic_iot",
  "measure_description": "Manually measured",
  "measure_device": "Shelly PM Mini Gen3",
  "measure_method": "manual",
  "name": "Hardware Bridge",
  "discovery_by": "device",
  "only_self_usage": true,
  "sensor_config": {
    "energy_sensor_naming": "{} Device Energy",
    "power_sensor_naming": "{} Device Power"
  },
  "standby_power": 0.51,
  "author_info": {
    "name": "Tim",
    "github": "EinRainerZufall"
  }
}
