{
  "measure_description": "Manually measured",
  "measure_method": "manual",
  "measure_device": "From manufacturer specifications",
  "name": "HM-LC-Sw1-DR",
  "standby_power": 0.35,
  "standby_power_on": 0.35,
  "sensor_config": {
    "power_sensor_naming": "{} Device Power",
    "energy_sensor_naming": "{} Device Energy"
  },
  "device_type": "smart_switch",
  "calculation_strategy": "fixed",
  "only_self_usage": true,
  "created_at": "2024-09-06T18:37:40",
  "author": "CV",
  "description": "Homematic DIN rail mount smart switch. This model is configured only for standby power usage of the smart device itself. The connected device(s) power usage must be configured by the user since it is possible to connect anything to it."
}
