{
  "aliases": [
    "A1Z88NGR2BK6A2"
  ],
  "calculation_enabled_condition": "{{ is_state('[[entity]]', 'playing') }}",
  "calculation_strategy": "linear",
  "created_at": "2026-01-06T16:49:11Z",
  "device_type": "smart_speaker",
  "linear_config": {
    "calibrate": [
      "10 -> 5.26",
      "20 -> 5.27",
      "30 -> 5.27",
      "40 -> 5.03",
      "50 -> 5.33",
      "60 -> 5.47",
      "70 -> 5.64",
      "80 -> 6.47",
      "90 -> 7.61",
      "100 -> 7.73",
      "0 -> 5.03"
    ]
  },
  "measure_description": "Measured with utils/measure script",
  "measure_device": "Nous A1T",
  "measure_method": "script",
  "measure_settings": {
    "SAMPLE_COUNT": 2,
    "SLEEP_TIME": 3,
    "VERSION": "v1.20.1:docker"
  },
  "name": "Echo Show 8 (Gen1)",
  "standby_power": 3.95,
  "author": "Jarod2801",
  "author_info": {
    "name": "Jarod2801",
    "github": "Jarod2801"
  }
}
