{
  "measure_description": "Manually measured. Transcribed from https://github.com/bramstroker/homeassistant-powercalc/files/11778846/measurements.xlsx",
  "measure_method": "manual",
  "measure_device": "Zhurui PR10-D",
  "name": "AVM Fritz!DECT 200",
  "standby_power": 0.45,
  "standby_power_on": 1.0,
  "sensor_config": {
    "power_sensor_naming": "{} Device Power",
    "energy_sensor_naming": "{} Device Energy"
  },
  "device_type": "smart_switch",
  "calculation_strategy": "fixed",
  "only_self_usage": true,
  "created_at": "2023-06-19T08:02:31",
  "author": "daloki83"
}
