{
  "calculation_strategy": "lut",
  "created_at": "2026-04-21T17:42:12Z",
  "device_type": "light",
  "measure_description": "Measured with utils/measure script",
  "measure_device": "Shelly 1PM Mini Gen4",
  "measure_method": "script",
  "measure_settings": {
    "SAMPLE_COUNT": 1,
    "SLEEP_TIME": 3,
    "VERSION": "v1.20.13:docker"
  },
  "name": "Hue white ambiance Aurelle square panel light 120x30",
  "standby_power": 0.43,
  "author": "EpicFazer",
  "author_info": {
    "name": "EpicFazer",
    "github": "EpicFazer",
    "email": "jan.h@ikmail.com"
  }
}
