{
  "measure_description": "Manually measured. Set to 0.29 as fell below detection range in standby mode",
  "measure_method": "manual",
  "measure_device": "TP-Link Tapo P110",
  "name": "Arlec Grid Connect Smart Plug In Multi-Function Socket With USB",
  "standby_power": 0.66,
  "standby_power_on": 1.596,
  "sensor_config": {
    "power_sensor_naming": "{} Device Power",
    "energy_sensor_naming": "{} Device Energy"
  },
  "device_type": "smart_switch",
  "calculation_strategy": "fixed",
  "only_self_usage": true,
  "created_at": "2022-09-06T08:26:19",
  "author": "Daniel O'Connor <daniel.oconnor@gmail.com>"
}
