{
  "aliases": [
    "A3S5BH2HU6VAYF"
  ],
  "author": "zenzmatz <eric.021292@gmail.com>",
  "calculation_enabled_condition": "{{ is_state('[[entity]]', 'playing') }}",
  "calculation_strategy": "linear",
  "created_at": "2025-05-06T13:39:22Z",
  "device_type": "smart_speaker",
  "linear_config": {
    "calibrate": [
      "10 -> 2.04",
      "20 -> 2.11",
      "30 -> 2.26",
      "40 -> 2.37",
      "50 -> 2.41",
      "60 -> 2.45",
      "70 -> 2.49",
      "80 -> 2.53",
      "90 -> 2.66",
      "100 -> 2.71",
      "0 -> 2.13"
    ]
  },
  "measure_description": "Measured with utils/measure script",
  "measure_device": "Shelly PM Mini Gen3",
  "measure_method": "script",
  "measure_settings": {
    "SAMPLE_COUNT": 2,
    "SLEEP_TIME": 3,
    "VERSION": "master"
  },
  "name": "Echo Dot (Gen2)",
  "standby_power": 1.8,
  "author_info": {
    "name": "zenzmatz",
    "email": "eric.021292@gmail.com",
    "github": "zenzmatz"
  }
}
