{
  "measure_description": "Measured manually",
  "measure_method": "manual",
  "measure_device": "PeakTech P 4250 (1 mV/10 mA) with VOLTCRAFT VC270",
  "name": "ZBMINI",
  "standby_power": 0.33,
  "standby_power_on": 0.49,
  "sensor_config": {
    "power_sensor_naming": "{} Device Power",
    "energy_sensor_naming": "{} Device Energy"
  },
  "device_type": "smart_switch",
  "calculation_strategy": "fixed",
  "only_self_usage": false,
  "aliases": [
    "Zigbee two way smart switch (ZBMINI)",
    "01MINIZB"
  ],
  "created_at": "2023-03-12T09:13:10",
  "author": "TyzzyT <80623729+TyzzyT@users.noreply.github.com>"
}
