{
  "aliases": [
    "4096"
  ],
  "calculation_strategy": "fixed",
  "created_at": "2026-04-18T23:21:36Z",
  "device_type": "smart_switch",
  "measure_description": "Manually measured with a dummy load attached at 25W (average over 600s) and 4 devices, than calculated average of that.",
  "measure_device": "Shelly PM Mini Gen3",
  "measure_method": "manual",
  "name": "GRILLPLATS Smart Plug (Matter)",
  "only_self_usage": true,
  "sensor_config": {
    "energy_sensor_naming": "{} Device Energy",
    "power_sensor_naming": "{} Device Power"
  },
  "standby_power": 0.22,
  "standby_power_on": 0.47,
  "author_info": {
    "name": "Tim",
    "github": "EinRainerZufall"
  }
}
