{
  "name": "EPSON L6270 Series",
  "calculation_strategy": "fixed",
  "device_type": "printer",
  "measure_method": "manual",
  "measure_device": "Shelly Plus Plug S",
  "measure_description": "Printer was measured while idle and while printing",
  "fixed_config": {
    "states_power": {
      "idle": 1.52,
      "printing": 12
    }
  },
  "created_at": "2024-12-06T12:00:00",
  "author": "Andrzej Dopierala <undefine@aramin.net>"
}
