{
  "measure_description": "Manually measured with dummy load attached at 7.7W (average over 300s) multiple times, than calculated average of that.",
  "measure_device": "Shelly PM Mini Gen3",
  "measure_method": "script",
  "measure_settings": {
    "VERSION": "v1.17.1:docker"
  },
  "name": "HmIP-FROLL",
  "standby_power": 0.12,
  "standby_power_on": 0.2,
  "sensor_config": {
    "power_sensor_naming": "{} Device Power",
    "energy_sensor_naming": "{} Device Energy"
  },
  "device_type": "cover",
  "calculation_strategy": "fixed",
  "fixed_config": {
    "states_power": {
      "opening": 0,
      "closing": 0
    }
  },
  "sub_profile_select": {
    "matchers": [
      {
        "type": "entity_state",
        "entity_id": "cover.{{source_object_id}}",
        "map": {
          "closing": "closing",
          "opening": "opening"
        }
      }
    ],
    "default": "no_movement"
  },
  "created_at": "2025-02-04T18:37:40",
  "author": "CV",
  "description": "HomematicIP flush mounted shutter actuator. This model is only configured to calculate the power usage of the smart actuator itself because the shutter motor connected is individual and can have different power draw even windows-by-window."
}
