{
  "measure_description": "Manually measured",
  "measure_method": "manual",
  "measure_device": "Aqara Smart Plug EU (SP-EUC01)",
  "name": "Dreo smart tower fan",
  "standby_power": 1.04,
  "linear_config": {
    "attribute": "percentage",
    "calibrate": [
      "16 -> 17.76",
      "33 -> 22.39",
      "50 -> 25.75",
      "66 -> 28.61",
      "83 -> 32.19",
      "100 -> 39.62"
    ]
  },
  "device_type": "fan",
  "calculation_strategy": "linear",
  "created_at": "2025-07-14T10:10:08.375127+02:00",
  "author": "miggi92 <miggi92@users.noreply.github.com>"
}
