{
  "measure_description": "Manually measured. Transcribed from https://www.youtube.com/watch?v=RlSCe9xaUPE",
  "measure_method": "manual",
  "measure_device": "GW Instek GPM-8310",
  "name": "Shelly 3EM",
  "aliases": [
    "SHEM-3"
  ],
  "discovery_by": "entity",
  "device_type": "smart_switch",
  "calculation_strategy": "fixed",
  "only_self_usage": false,
  "standby_power": 1.22,
  "standby_power_on": 1.22,
  "sensor_config": {
    "power_sensor_naming": "{} Device Power",
    "energy_sensor_naming": "{} Device Energy"
  },
  "created_at": "2024-12-01T18:27:00",
  "author": "RubenKelevra <cyrond@gmail.com>"
}
